"website","url","title","description","location","company","experience","worktype","industry","function","publish_date","insert_date"
linkedin,https://es.linkedin.com/jobs/view/project-manager-at-mucho-2548577345,Project Manager,"The Mucho Barcelona team is looking for an experienced Project Manager to support one of the studio's teams in planning the workload of each project and aligning process expectations between the client and the design team. This person will report directly to the Creative Director and Managing Director.Who we are? Mucho is an international branding studio. It integrates branding, creative strategy and transmedia design with the aim of building visual narratives that transform a brand’s culture. The studio works on global projects from its offices in Barcelona, San Francisco, New York, Paris and Melbourne. Mucho Design is an equal opportunity employer, which enthusiastically supports diversity in the workforce.What you will do....Lead day-to-day project contact with all kind of level clients, creative teams and other agency partners.Be capable to listen carefully to the client and creative team needs/requests to report them accurately. Develop project timing plans with long and short term milestones, understanding the priorities of resources and tasks in the pursuit of a proper management of the project. Organize the workload of a 6-member team assuring the team effectiveness and the hopes up! Own the client budget/scope and working with senior team members to manage costs and deliverables as well as staffing resourcesUphold all project's quality. Fulfill, check and review the outputs as deliverables against the scope. Assess project risk on an ongoing basis, escalating issues as needed.Perform as a leader of presentations/meetings with clients and stakeholders. Preparation of strategy or design presentationsGive support to the strategy team on brand narrative building processes as much as verbal identity, benchmarking, branded content material development. Manage all social media platforms (partially) from the studio alongside the social media team. Aid the management team with new business matters and credentials preparation.TimetrackingSupport in studio tasks/needsWhat are the requirements? Bachelor’s degree in advertising, marketing, communications, design management, Business or similar area.More than 4 years of experience working in agencies – creative, branding, advertising – or performance as a brand manager.Fluent English, written and speak (this is a mandatory requirement as the job position requires a person in constant contact with international clients).Established experience of running a variety of global projects and brand roll-outs across multiple channels, including. From planning through to delivery.Detail-driven. Ability to zoom in on each phase of the project development.High level of language and communication skills as well as an interest in copywriting. Strong internal relationships (particularly with creative team).","Barcelona, Cataluña, España",Mucho,,Jornada completa,,,2021-05-18 14:38:34,2021-05-18 15:00:00
linkedin,https://es.linkedin.com/jobs/view/es-field-service-technician-representative-at-suez-2548574758,ES - Field Service Technician/Representative,"Contract typeRegular / PermanentWho We AreSUEZ Water Technologies & Solutions looks for innovation everywhere. For more than 100 years, SUEZ has been at the forefront of innovation, from the SUEZ Canal to addressing water scarcity. Finding solutions to the world's biggest problems has never been more important than right now.What You Will Be Doing Roles & Responsibilities: The FSR is providing well-described tasks in the water treatment area (Engineered Solutions). She or he provides service where needed, mainly in Spain and Portugal, but not limited to. He or she will be based on Tenerife.The following activities are a guideline; others can be part of the job scope EH&S compliance.  Equipment Start-up and Commissioning.  Operation & Maintenance activities at Fixed Sites and Mobile Units.  Repair/Maintenance/warranty work  Aftermarket specific technical assistances.  Minor assembly, as required.  Site manager for new projects or upgrades.  Contractor supervision.  Execute minor chemical analysis on site.  Customer and internally reporting/Data processing.  Participation in Piloting and Field trials.  Participation in the local team meetings to share best practices.  Travel within the geographic area when required.  Help with Site Surveys.  Focal contact person at customer site.  Quality Management of contracts assigned. Who We Are Looking For  Skill sets required:  q Service mentality, customer is our priority.q Skills to manage technical problems at customer site.q Skills to work within a wide team in Europe.q Diplomacy and Communication skills.q Good Electrical and Mechanical background and experience.Use of tools.q Availability to work in shifts and weekends.q Availability to travel around the country and Portugal.q Language skills: high English level. French will be a plus.q Computer base knowledge (Word/Excel/Outlook).q Water treatment technologies knowledge desired.Academic Educationq Industrial engineer or similar.CompensationMonthly 0.00 - 0.00 EURIs relocation for this position offered:Number of Job Openings: 1Company Grade/BandWater Technologies and Solutions (WTS) offers a great work environment, professional development, challenging careers, and competitive compensation.WTS is an Equal Opportunity Employer. Employment decisions are made without regard to race, color, religion, national or ethnic origin, sex, sexual orientation, gender identity or expression, age, disability, protected veteran status or other characteristics protected by law.#IndeedWTS:No","Canarias, España",SUEZ,No corresponde,Jornada completa,Servicios medioambientales,"Ingeniería,Tecnología de la información",2021-05-18 14:38:41,2021-05-18 15:00:00
linkedin,https://es.linkedin.com/jobs/view/business-data-analyst-junior-at-vocento-2548574635,Business Data Analyst Junior,"Vocento es uno de los principales grupos multimedia de España, dedicado a la actividad en medios de comunicación, con posicionamiento relevante nacional y regional, y actividades adicionales de diversificación, como la gastronomía que tiene un alcance internacional, así como una sólida red de clasificados en los sectores de motor e inmobiliario.Buscamos a un profesional junior para incorporarse a nuestro equipo de Analytics & Data Management dentro del área de Data Government, con una experiencia de 1 o 2 años.La principal responsabilidad consistirá en ayudar al equipo con las siguientes tareas:1. Análisis de información de sistemas y procesos de actualización:Capacidades de manejo de grandes volúmenes de datos.Capacidades de prospección en base de datos.2. Explotación de información de sistemas con objetivo de normalización y mejora de calidad:Capacidad de analítica y definición de cuadros de mando.Capacidad de obtención y definición de KPIs de seguimiento.Capacidad de trabajo con modelos de negocio predictivos.3. Análisis de procesos de integración entre sistemas:Capacidad de optimización de procesos de negocio.Capacidad de adaptación en el aprendizaje de herramientas con distintas funciones.4. Gestión de proyectos:Experiencia en metodologías ágiles.Experiencia en herramientas de planificación con diversos parámetros.¿Qué conocimientos requerimos?Conocimiento de Herramientas de Visualización de Información: Qlik Sense, Tableau…Conocimiento de análisis estadístico avanzado: Data Mining.Conocimiento en entornos Big Data.Lenguaje R.Python.Conocimientos en áreas de negocio: RRSS, herramientas de validación de usuario, ecommerce, email marketing, analítica digital, …Nivel alto de inglés. Habilidades necesariasEnfoque proactivo.Trabajo en equipo.Orientación al cliente interno y externo.Atención al detalle y compromiso con la excelencia en el desarrollo de sus tareas.Capacidad para escuchar y comunicar bien con interlocutores muy distintos.Capacidad para manejar múltiples tareas y prioridades.Si tienes experiencia en el puesto y te apetece incorporarte a nuestro equipo ¡apúntate a esta oferta!En virtud del Reglamento General de Protección de Datos, le informamos de que la sociedad a cuya vacante se postula usted como candidato es la responsable del tratamiento de los datos de carácter personal que se traten con objeto de llevar a cabo el proceso de selección. El tratamiento se realiza en base al interés legítimo de la sociedad. Sus datos podrán ser comunicados a Administraciones públicas en cumplimiento de la legislación aplicable, y a prestadores de servicios tecnológicos y de selección. Usted tiene derecho a acceder, rectificar y suprimir sus datos, entre otros.",Madrid y alrededores,Vocento,Algo de responsabilidad,Jornada completa,Medios de difusión,"Marketing,Tecnología de la información,Análisis",2021-05-18 14:36:51,2021-05-18 15:00:00
linkedin,https://es.linkedin.com/jobs/view/consultor-t%C3%A9cnico-comercial-supply-chain-at-randstad-espa%C3%B1a-2555083995,Consultor Técnico Comercial - Supply Chain,"Nuestro cliente es una importante consultoría multinacional dedicada a desarrollar e implementar soluciones tecnológicas para la gestión y optimización de inventarios. Necesita incorporar un Técnico Comercial con experiencia en el ámbito de la supply chain cuyas funciones principales son:  - Apertura de nuevas cuentas. - Comercialización de proyectos de implantación de aplicaciones informáticas especializadas en la previsión de la demanda y la gestión de reaprovisionamiento. - Comprender necesidades, diseñar propuesta, negociar, planificar y controlar proyectos, desde la prospección y preventa, hasta la contratación.    requisitos del puesto: - Muchas ganas de desarrollar su carrera profesional dentro de una consultoría internacional- Formación académica: Ingeniero técnico o superior, ADE, o Económicas- Experiencia mínima, demostrable, de 2 años dentro del ámbito de la planificación de la demanda y gestión de aprovisionamiento o comercializando o implantando soluciones informáticas- Conocimientos en Logística, Cadena de Suministro, Previsión de la demanda y Gestión del inventario- Capacidad de actuar con gran autonomía y manejar múltiples tareas asignadas- Buena capacidad de presentación frente a posibles clientes y excelente comunicación- Dominio de Microsoft Office- Conocimientos en uso de bases de datos (MS SQL Server, MS Access)- Conocimientos de aplicaciones ERP, SGA, SCM- Habituado al trabajo por objetivos- Vehículo propio y disponibilidad para viajar- Idiomas: castellano e inglés","Viladecans, Cataluña, España",Randstad España,Algo de responsabilidad,Jornada completa,Logística y cadena de suministro,"Estrategia/planificación,Cadena de abastecimiento,Ventas",2021-05-18 14:34:01,2021-05-18 15:00:00
linkedin,https://es.linkedin.com/jobs/view/dise%C3%B1ador-de-p%C3%A1ginas-web-at-medicina-televisi%C3%B3n-2548567783,Diseñador de páginas web,Medicina Televisión busca incorporar a su equipo una persona con experiencia en Diseño de páginas web. Se ofrece incorporación a jornada completa.,"Madrid, Comunidad de Madrid, España",Medicina Televisión,,Jornada completa,,,2021-05-18 14:34:11,2021-05-18 15:00:00
linkedin,https://es.linkedin.com/jobs/view/administrativo-contable-at-kuatro-2541781913,Administrativo contable,En Kuatro estamos buscando a una persona para el departamento administrativo/contable.La persona seleccionada se encargará de realizar las siguientes funciones:· Confirmaciones de pedidos y albaranes· Tareas administrativas (import-export)· Atetender llamadas telefónicas.Conocimientos: · Paquete Office· Conocimientos informáticos software gestión empresarial.· Nivel alto de Inglés (demostrable en la entrevista)· Nivel alto de francés (se valorará muy positivamente)Se ofrece contrato de 40 horas semanales (L-V) Abstenerse personas que no tengan experiencias similares o con perfil no acorde con el puesto.Kuatro · Empresa productora de alfombras en constante crecimiento.,"Paterna, Comunidad Valenciana / Comunitat Valenciana, España",Kuatro,,Jornada completa,,,2021-05-18 17:02:25,2021-05-18 17:00:00
linkedin,https://es.linkedin.com/jobs/view/ingeniero-de-proyecto-at-cubicoff-ingenieria-abierta-2555263933,Ingeniero de proyecto,"Ingeniero eléctrico o mecánico, PMP certified deseable.",Sevilla y alrededores,Cubicoff Ingenieria abierta,,Jornada completa,,,2021-05-18 17:01:33,2021-05-18 17:00:00
linkedin,https://es.linkedin.com/jobs/view/manager-real-estate-energ%C3%ADas-renovables-at-kira-ventures-2547588090,Manager Real Estate Energías Renovables,"Kira Ventures es una firma de asesoría integral, promoción y gestión de activos que identifica y acelera nuevas oportunidades de inversión en la transición a un nuevo modelo económico impulsado por las energías renovables.¿Startup? ¿Asesores financieros? ¿Expertos en renovables? Sí, somos todo esoAbarcamos todo el ciclo de vida de la inversión en tecnologías que incluyen solar fotovoltaica, eólica y mini hidráulica. Con más de 60 años de experiencia acumulada, el equipo detrás de Kira lo conforman emprendedores, ingenieros y financieros de la transición energética.Buscamos a una persona con experiencia previa de al menos 3-5 años en departamento de promoción de proyectos de energía renovable o Real Estate, valorable experiencia en negociación de contratos de terreno, para incorporarse como Manager a una nueva unidad de negocio dentro del equipo de Kira.Rol y responsabilidades:Liderar la creación de una nueva unidad de negocio que combina las energías renovables y el Real EstateResponsable de la originación de oportunidades de inversión y la negociación de contratos y condiciones económicasGestión de la red de colaboradores de KiraValoración financiera de oportunidades de inversión y modelización Reporting a inversores ¿Qué necesitas saber?Se requieren 3-5 años de experiencia previa en el sector de las energías renovables o departamentos de Real EstateTitulación: Grado Ingeniería, ADE/ADE y Derecho o Económicas Nivel de inglés medio/alto Dominio del paquete MS Office y capacidad de modelar en Excel Alta iniciativa y capacidades de negociación Carnet de conducir y disponibilidad para viajar¿Qué te puede aportar Kira?Desarrollo de talento y fomento de una cultura empresarial moderna y accesible Salario competitivo de mercado ajustado a experiencia y acceso a bonusLibertad de horariosEmpresa joven y gran ambiente de trabajoExposición a gran red de clientes y relación con ejecutivos C-level","Madrid, Comunidad de Madrid, España",Kira Ventures,,Jornada completa,,,2021-05-18 14:33:20,2021-05-18 15:00:00
linkedin,https://es.linkedin.com/jobs/view/cmo-co-founder-at-star-startups-2555080939,CMO & Co-founder,"¡Esto no es una oferta de empleo! Es la oportunidad de ser seleccionado/a en el PROGRAMA DE INCUBACIÓN de Star Startups. ¿Qué es Star Startups?Star Startups tiene como misión crear startups en base pre-team y/o pre-idea, invirtiendo en el mejor talento emprendedor. En Star Startups ayudamos a impulsar tu negocio a lo más alto, o crear negocios innovadores desde 0 con mentorización ad hoc al emprendedor/a por parte de profesionales en el ecosistema. Los CMO & Co-founders son figuras clave en la mayoría de nuestros proyectos. Además de ser los encargados de dar voz y visibilidad a su proyecto, son los co-líderes del proyecto y los co-responsables de desarrollar y escalar una idea de negocio, validando previamente la necesidad. Para co-liderar un proyecto, has de cumplir uno o más de los siguientes requisitos:Experiencia en el ecosistema startup o en empresas tecnológicas.Una mentalidad emprendedora con excelentes habilidades organizativas y de liderazgo.Habilidades analíticas y habilidades para la resolución de problemas.Excelentes habilidades para comunicarse y hablar en público.Conocimientos de marketing digital y gestión de Redes Sociales.Disponibilidad a tiempo completo y pasión por el sector digital.Por último, pero no menos importante: ambición, sentido del humor y una actitud positiva de ""puedo hacer"". Beneficios de emprender con nosotros·  	Co-fundar una empresa con potencial alza financiera.·  	Una oportunidad para ser emprendedor dentro de un ecosistema líder de creación de empresas.·  	Formar parte de un equipo experto y sólido.Te lo pasarás en grande en nuestras Hackathons.Pondrás a prueba tu agilidad mental, capacidad de resolución y astucia para los negocios.Conocer a más gente “extraña” y predispuesta como tú y como nosotros/as.Compartirás opiniones con mentores y especialistas de cada sector (sex tech, beauty, hostelería, tech, elearning, ecommerce, retail, etc.) Los equipos fundadores que emprenden con nuestras ideas cuentan con unas condiciones únicas:El 89% de la startup (a repartir entre el equipo fundador), con un 2% opcional para advisors.Ayudamos a buscar inversión inicial y soporte en la búsqueda de financiación inicial y futuraApoyo constante a través de los servicios centrales y del equipo humano que hay detrás de él, durante el periodo de incubación. Quiero emprender con Star Startups, ¿qué debo hacer?Inscríbete a los Star Days, el evento que celebramos para reunir a los potenciales emprendedores y, si eres seleccionado/a, pasarás a formar parte del Programa de Incubación Star donde recibirás formación, acompañamiento, apoyo, instalaciones, inversión y mucho más para que lideres, desarrolles y potencies tu propio proyecto.","Valencia/València, Comunidad Valenciana / Comunitat Valenciana, España",Star Startups,,Jornada completa,,,2021-05-18 14:32:29,2021-05-18 15:00:00
linkedin,https://es.linkedin.com/jobs/view/desarrollador-web-at-auto-cristal-ralarsa-2548574552,Desarrollador web,"Seleccionamos un programador.Programador con conocimientos de Php-CodeIgniter-.NET con experiencia en programación WebServices y buen nivel de inglés técnico.Jornada completaEn cuanto a nosotros...Somos una empresa con más de 40 años liderando el sector de lunas de automóvil, pionera en impulsarla primera red de talleres especializada en Cristalería del Automóvil, de ámbito nacional con más de 240 talleres.¿Qué tareas desarrollarías?·Participar en proyectos relacionados con la evolución de la actual plataforma.·Apoyar al departamento de tecnología en el mantenimiento, diseño y desarrollo de aplicaciones sólidas que puedan satisfacer las necesidades internas de la empresa y la demanda del mercado desarrollando las siguientes funciones:- Actualización y mantenimiento de sitios/aplicaciones web.- Desarrollo y mantenimiento de procesos de backend entre diferentes aplicaciones y fuentes de datos.- Diseño y desarrollo de nuevas funcionalidades en aplicaciones existentes.- Participación en el diseño y desarrollo de productos digitales","Terrassa, Cataluña, España",Auto Cristal Ralarsa,,Jornada completa,,,2021-05-18 14:32:37,2021-05-18 15:00:00
linkedin,https://es.linkedin.com/jobs/view/posiciones-sap-at-krell-consulting-2555081901, POSICIONES SAP,"Buscamos distintos perfiles SAP, para importantes clientes en toda España (Madrid, Barcelona, Málaga, Sevilla, Palma de Mallorca... o teletrabajo desde cualquier parte de España):.- Consultores SAP HCM ( SSFF o PA/PY o ESS/MSS).- Consultores SAP FICO.- Consultores SAP SD/MM.- Consultores SAP ARIBA.- Consultores SAP BPC, BO, BW, BI.- Consultores SAP QM, PP, PM, PO.- Consultores SAP PLM.- Consultores SAP PPM.- Consultores SAP WM, EWM, LE.- Consultores SAP SCM APO.- Consultores SAP ECTR.- Consultores SAP ME/MII.- Consultores SAP IU5 Fiori.- Consultores SAP S/4 HANA.- Consultores SAP C4C/CRM.- Consultores SAP ACR.- Consultores SAP EPM.- Consultores SAP PO/PI.- Consultores SAP EPM.- Consultores SAP Hybris.- Analistas Programadores ABAP.- Administradores de Sistemas SAP BASIS","Madrid, Comunidad de Madrid, España",Krell Consulting,Sin experiencia,Jornada completa,Consultoría de estrategia y operaciones,"Tecnología de la información,Recursos humanos",2021-05-18 14:31:44,2021-05-18 15:00:00
linkedin,https://es.linkedin.com/jobs/view/t%C3%A9cnico-junior-sistemas-y-o-desarrollo-at-sivsa-2548575335,Técnico Junior Sistemas y/o Desarrollo,"Desde SIVSA, estamos buscando un Técnico Junior Sistemas y/o Desarrollo para un ente público en Asturias (Oviedo).Funciones a desempeñar:La resolución de incidencias, problemas y cambios, así como la ejecución de tareas necesarias para el lanzamiento de aplicaciones y versiones incluyendo en las mismas la fase de test.Instalación y parametrización de todo el software necesario para el correcto funcionamiento de los Sistemas de Información objeto del contrato, diferentes del Sistema Operativo de la máquina y de las aplicaciones de puesto cliente.Realización de todas aquellas tareas de Administración, Gestión y Operación diaria sobre las Bases de Datos. Participación activa en los procesos ITIL v3 actualmente implantados, así como la realización y el mantenimiento de la documentación asociada a los servicios del Lote.La participación en la gestión y ejecución de actuaciones y proyectos que requieran adaptar y/o evolucionar estos servicios.Formación necesaria:Formación profesional de Grado Superior en materia relacionada con Informática con al menos dos años de experiencia en funciones TIC como Técnico Junior o como Técnico Senior o como Jefe de Proyecto.Titulado medio o superior en Informática o Grado en materia relacionada con la informática con al menos 6 meses de experiencia en funciones TIC como técnico junior TIC como Técnico junior o como Técnico Senior o como Jefe de Proyecto.Titulado medio o superior o Grado con al menos 4 años de experiencia en funciones TIC como Técnico Junior o como Técnico Senior o como Jefe de Proyecto.Idiomas:Castellano.Tecnologías imprescindibles:BBDD (Informix, Oracle, SQL Server, Interbase, MySQL)Desarrollo aplicaciones (Delphyn, ASP, PHP)6. Tecnologías valorables:• Portainer 1.16.5 -> Gestión de la nube.• Git 10.8.0 -> Repositorio de gestión de fuentes, scripts, documentación, control de versiones.• Jenkins 2.164.3 -> Orquestador/automatizador de tareas en general (seguridad, compilación, calidad, aplicación de parches, generación de documentación, validación y ejecución de scripts…). • Nexus 3.15.1 -> Repositorio de artefactos, se encarga del almacenamiento y versionado de los fuentes/desplegables entregados por los proveedores de desarrollo.• Nginx 1.12 -> Proxy inverso para la gestión de acceso a las herramientas.• SonarQube 7.1 -> Revisión de la calidad del software.• ELK/Elastic Stack 6.6.1 -> Paquete formado por:- Elasticsearch -> Motor de análisis y búsqueda de texto completo altamente escalable. Se usa como almacenamiento de logs.- Kibana -> Se utiliza para buscar, ver e interactuar con los datos almacenados en Elasticsearch.- Logstash -> Recopilador de datos de diferentes fuentes para su envío normalizado a Elasticsearch.- Beats -> Agentes instalados en los servidores para envío de datos a Elasticsearch mediante Logstash.• MediaWiki 1.31.1 -> Documentación de la plataforma.• MongoDB 3.6.4 -> Base de datos (no SQL) orientada a documentos, usada para guardar información en formato JSON de cada despliegue que pasa por de la plataforma.• MaríaDB 10.3.11 -> Base de datos para la MediaWiki.• JMeter 4.0 -> Ejecución de pruebas de rendimiento.• Selenium 3.9.1 -> Ejecución de pruebas funcionales.• Maven/ANT (la versión depende de cada proveedor de aplicaciones) -> Compilación de aplicaciones J2EE.Aplicaciones Ámbito SanitarioCompetencias personales:Al tratarse de un trabajo en el que se va a dar soporte: empatía, don de gentes, trabajo en equipo, resiliencia…Años de experiencia mínimo:En función de la formación académica.Duración aproximada:Se trata de un concurso que tenemos hasta marzo de 2023., renovable cada 2 añosLugar de trabajo:En las oficinas de Oviedo.Horario:Aproximadamente de 8 a 15 horas, con adaptación hasta cumplir las 40 horas semanalesSe ofrece: Te incorporarás a una compañía en expansión y queremos seguir creciendo contigo.• Formarás parte de un equipo para realizar interesantes proyectos de la mano de profesionales del sector.• Desarrollo de carrera con evaluaciones de desempeño anuales.• Posibilidad de formarte y mejorar tu desempeño en el puesto.• Trabajar en un entorno global.Somos una compañía consolidada dedicada a la prestación de servicios en el área de las Tecnologías de la Información, con más de 30 años de experiencia en consultoría y desarrollo, con presencia a nivel internacional en Brasil, Portugal, Perú, Chile y Marruecos.","Oviedo, Principado de Asturias, España",SIVSA,No corresponde,Jornada completa,Servicios y tecnologías de la información ,"Tecnología de la información,Consultoría,Desarrollo empresarial",2021-05-18 14:31:53,2021-05-18 15:00:00
