"website","url","title","description","location","company","experience","worktype","industry","function","publish_date","insert_date"
linkedin,https://es.linkedin.com/jobs/view/test-engineer-at-sage-2541782300,Test Engineer,"Job Description  Advert  People make Sage great. From our colleagues delivering ground-breaking solutions to the customers who use them: people have helped us grow for more than thirty years, and people are driving our future as a great SaaS company. We’re writing our next chapter. Be part of it!Experience has taught us that when our customers thrive, we thrive. As a team, we always start with what customers need. Through the good… and more challenging times. Innovating at pace so customers can manage their finances, operations and people. Every one of us shapes our culture at Sage - doing what’s right and succeeding together, united by our commitment to each other. We encourage each other to grow in our roles, in our careers and as individuals.Follow us on our social media sites below to join in conversations about career tips, open positions and company news! #lifeatsage #sagecareers. If you would like support with your application (or require any adjustments) please contact us at careers@sage.com for assistance. All qualified applicants will be thoughtfully considered and never discriminated against based on their race, color, age, religion, sexual orientation, gender identity, national origin, disability or veteran status. Descripción  This role is one that demands a passion for continuous improvement of product, system and customer knowledge. One progression step further than an Entry Level role, a team member in a Test Engineer role should expect to manage their own project work items, actively share knowledge across the testing community and work closely with the delivery teams to carry out thorough and efficient testing to team processes and testing standards. The Test Engineer will create accurate test plans, and execute against these, ensuring that all issues and risks are raised and managed to completion. The Test Engineer will have an eye for detail and be quality focussed resulting in thorough and well-organised test phases across all projects they work on. Responsabilidades principales   Demonstrate a level of understanding of the system under test and gain an understanding of how customers use the products under test. Create and track to accurate and timely test estimates for projects Collaborate with the delivery team to create source documents used for testing artefacts and create and maintain test artefacts that maximise the efficiency of the test phase, cover all requirements and allow for timely delivery of products and/or components to our customers Execute different testing approaches within each defined stage of development and keep up to date with advances in the discipline, e.g. rapid, risk based, exploratory, regression, security, usability etc. Have an awareness of the test automation framework and as a result create, execute and maintain efficient and effective test automation scripts Take accountability for all test related activities within a test phase, accurately record and communicate risks and issues found during test phases and produce effective test metrics for the Test Team Lead Share knowledge and expertise across the wider testing team and where required coach others to avoid key person dependency Carry out such tasks as directed to meet the needs of the businessSkills, Know-how And Experience Natural high level of attention to detail in all aspects of working. As a tester this might range from noticing pixel misalignment, legislative calculation inaccuracies or subtle differences in performance Able to multi-task effectively, prioritise and plan own time to ensure deadlines are met Good problem solving approach; always able to provide logical solutions and options Clear verbal and written communication style to enable conversations with all levels of stakeholder including direct customers and to ensure accurate issue recording Must be able to assess tasks for the best testing approach and apply these throughout the different phases of a project. A rapid ‘pick up and learn approach’ that will ensure valuable contribution to any team within days of joining the teamWhat We OfferLatest technology stackInternational atmosphereBrand new office space, located at the heart of Barcelona’s 22@ tech district, with great transport linksFlexible benefits that suit your needsChoice between Windows or OSX laptopsUp to 5 days special personal leave per year for charitable work and volunteering of your choiceLong-term prospects for a professional career, clear path to growWork from home daysGenerous bonus schemaReduced working hours in the summerOpportunity to travel and meet other teams that you cooperate with","Barcelona, Cataluña, España",Sage,Intermedio,Jornada completa,"Servicios y tecnologías de la información ,Recursos humanos,Consultoría de estrategia y operaciones","Ingeniería,Tecnología de la información",2021-05-19 06:42:27,2021-05-19 07:00:00
linkedin,https://es.linkedin.com/jobs/view/administrador-a-de-sistemas-cloud-azure-at-sogeti-2555024921,Administrador/a de sistemas - Cloud Azure,"¿Te gustaría pertenecer a una empresa comprometida con sus empleados y certificada con el sello Top Employer 2020 en España? En la actualidad estamos ampliando nuestro equipo en Soluciones Microsoft donde somos Partners oficiales, por lo que queremos incorporar un/a Administrador/a de sistemas en cloud Azure, para un proyecto con un importante cliente del sector audiovisual. Funciones: · Velar por la continuidad, seguridad y correcta operación de los sistemas sobre las plataformas onprem y Cloud· Asistir al equipo en tareas de mantenimiento y configuración· Gestión de las peticiones para proyectos· Seguimiento del ticketing y tareas· Evolución de los sistemas configurados para mejora de la continuidad de negocio· Buscar como adaptar los sistemas a las necesidades de la organización· Se valorará certificaciones en Microsoft. Para el puesto se necesitan conocimientos técnicos avanzados de Active Directory, Azure, Windows Server, Linux, Administración de Azure y O365, SQL Server, Vmware e Hyper-V, Sistemas de monitorización basados en Nagios, Antivirus (preferiblemente Deep Security), Direct Access y CITRIX. ¿Que ofrecemos? · Remuneración competitiva según experiencia y valía.· Certificaciones oficiales de Microsoft a cargo de la compañía.· Tarjeta restaurante.· Flexibilidad horaria y teletrabajo (*según proyecto).· Tickets guardería.· 24 días de vacaciones laborables anuales más 2 días de asuntos propios.· 50% descuento en el seguro médico.· Plan de formación personalizado con cursos técnicos presenciales y e-learning además de programa de certificaciones a cargo de la empresa.· Curso de inglés online gratuito.· Seguro de vida y accidentes.· Buen ambiente de trabajo con la posibilidad de participar en actividades de Team building e iniciativas internas.· Desarrollar una carrera profesional en una multinacional líder en el sector de las nuevas tecnologías. Si estás buscando un entorno dinámico, multinacional, con grandes oportunidades de desarrollo y donde valores como la pasión por la tecnología, la innovación o el espíritu de equipo son parte de nuestro ADN, esta es tu oportunidad.","Barcelona, Cataluña, España",Sogeti,Algo de responsabilidad,Jornada completa,Servicios y tecnologías de la información ,"Ingeniería,Tecnología de la información",2021-05-18 12:56:03,2021-05-18 13:00:00
linkedin,https://es.linkedin.com/jobs/view/analista-de-cr%C3%A9ditos-baja-paternal-at-volkswagen-financial-services-spain-2555026665,Analista de Créditos (Baja Paternal),"Somos un equipo dinámico, activo y buscamos reinventarnos constantemente, nuestra empresa está en un momento de plena transformación. Actualmente estamos en búsqueda de un Analista de Créditos (Baja Paternal) para dar apoyo a nuestro departamento de Riesgos.  ¿Cuáles serán tus tareas? Análisis de clientes Corporate, de sus avalistas y del grupo económico en diferentes niveles de decisión. Elaboración de informes de la situación económico-financiera de los clientes y grupos tratados.Emitir un juicio técnico para la toma de decisiones en los distintos niveles.Seguimiento de la situación económico-financiera de los clientes Corporate para prevenir situaciones que impliquen la imposibilidad de devolución de la deuda y en su caso proponer planes de actuación.Colaboración con nuestra matriz en Alemania para la decisión de crédito de ciertos grupos que superan las atribuciones locales. Para ello se prepararán informes en inglés y se mantendrán conversaciones con ellos.Valoración permanente de la situación de riesgo de los clientes Corporate mediante la revisión del grupo económico y actualización de la clase de Rating.Responsabilidad de decreto en el sistema y comunicación del mismo.Realización de informes sobre detección temprana de riesgo. Preparación de la documentación y resolución de dudas. ¿Qué buscamos?  Pensamos en una persona proactiva con habilidades analíticas, de organización y planificación. Formación: - Licenciatura/Grado en ADE, Económicas o similar. Conocimientos:- Conocimiento avanzado del entorno office (Word /ppt / Excel). Conocimientos financieros, balances, análisis de ratios y productos financieros. (Pólizas de crédito, financiación). Experiencia: - Imprescindible experiencia de analista de crédito de personas jurídicas / empresas de mínimo 2 años. Idiomas: - Nivel de inglés alto, hablado y escrito. ¿Qué te ofrecemos? Ambiente de trabajo dinámico.  Localización: MadridParticipación en proyectos punteros de la compañía.Salario competitivo (Según perfil del candidato/a).Atractivo paquete de beneficios sociales.Incorporación inmediata.¿Cómo será el proceso?Inscríbete en nuestra oferta estás en búsqueda de un nuevo reto y si crees que eres la persona que estamos buscando Si tu propuesta nos resulta interesante, nos pondremos en contacto contigo para organizar una primera reunión (Online), contarte más de nuestro proyecto y para que conozcas nuestra empresa.¡Envíanos tu CV! Estamos deseando conocerte.",Madrid y alrededores,Volkswagen Financial Services Spain,Intermedio,Jornada completa,Servicios financieros,Finanzas,2021-05-18 12:56:14,2021-05-18 13:00:00
linkedin,https://es.linkedin.com/jobs/view/becario-de-desarrollo-empresarial-at-aaa-2548557386,Becario de desarrollo empresarial,"Hola, buscamos un becario para nuestra dreamteam de AAA ! Buscamos una persona polyvalente y motivada para compartir todo tipo de tareas durante unos meses. MAIN TASK - sourcing y análisis de nuevos proyectos en España para promociones inmobiliarias y proyectos de coliving. ","Barcelona, Cataluña, España",AAA,,Prácticas,,,2021-05-18 12:55:23,2021-05-18 13:00:00
linkedin,https://es.linkedin.com/jobs/view/gerente-para-hospital-veterinario-at-alianza-petsalud-1368796286,Gerente para Hospital Veterinario,"GERENTE PARA HOSPITAL VETERINARIO ¿Te gustaría desarrollar tu carrera profesional en sector veterinario en uno de los grupos más importantes del país? Alianza Petsalud/Vetersalud es el primer grupo de clínicas y hospitales veterinarios de España con más de 15 años de experiencia. Actualmente estamos en pleno proceso de expansión y crecimiento por lo que necesitamos incorporar un Gerente en jornada completa para uno de nuestros hospitales en Madrid. En Alianza Petsalud/Vetersalud nos identificamos con personas amantes de los animales que tienen una actitud positiva, resolutivas y proactivas, nos gustan las personas que aportan nuevas ideas, que disfrutan del trabajo en equipo y tienen la capacidad de trabajar bajo presión, y en muchas tareas a la vez, pero siempre en un ambiente cordial, colaborativo, distendido y activo. ¿Qué necesitamos? El candidato ideal debe: Formación de grado medioConocimientos acreditables de administración de empresasExperiencia mínima de dos años como Gerente en centros veterinarios para pequeños animalesIncorporación inmediataManejo medio-avanzado de Excel¿Cuáles serán tus responsabilidades como Gerente?Garantizar la correcta ejecución del plan operativo del hospitalColaborar con los distintos departamentos centrales de la compañía para que los procesos, procedimientos y protocolos queden completamente implantados dentro del hospitalGestionar las acciones destinadas a la mejora de la calidad de atención al cliente, así como colaborar para el logro de la plena satisfacción de los clientesOrganizar y responsabilizarse de que las diferentes acciones y obligaciones administrativas del centro de trabajo se ejecuten correctamenteColaborar con los servicios centrales de la compañía en el buen mantenimiento de las instalaciones y equipamientosSer interlocutor entre los trabajadores del hospital con los socios y los servicios centrales de la compañía, de tal modo que se garantice la correcta realización de todos los aspectos formativos, organizativos, administrativos y contractuales de la plantillaGarantizar que los procesos de aprovisionamiento y de control de stock se realizan correctamente acorde a las indicaciones de la compañíaGarantizar la correcta implantación de campañas y productos preventivos comercializados en el hospital, así como la plena colaboración con el departamento de marketing para la comunicación óptima de los mismosContar con estas habilidades es un plus Capacidad de organización, trabajo multitarea de forma autónomaLiderazgo, capacidad de trabajo en equipo,Dotes de comunicación asertiva y empatíaConocimiento de marketing digital.¿Qué te ofrecemos? Contrato a jornada completaFormación continuada a cargo de la empresaDesarrollo profesional dentro de nuestra organización","Fuenlabrada, Comunidad de Madrid, España",Alianza Petsalud,,Jornada completa,,,2021-05-18 12:54:32,2021-05-18 13:00:00
linkedin,https://es.linkedin.com/jobs/view/t%C3%A9cnico-de-prl-y-medio-ambiente-at-pharmaloop-a-salvat-company-2555026344,Técnico de PRL y Medio Ambiente,"Desde Pharmaloop, laboratorio farmacéutico ubicado en Alcalá de Henares, buscamos incorporar a un Técnico de Prevención de Riesgos Laborales y Medio Ambiente que se ocupará de gestionar y realizar el seguimiento de dichas áreas. Será un contrato de interinidad para cubrir una baja por maternidad, sin posibilidad de continuar.FUNCIONES PRINCIPALES:GESTION DEL AREAProponer, elaborar y gestionar correctamente el presupuesto del área, tanto de materiales como de las subcontrataciones externas en orden a garantizar el logro de los objetivos establecidos anualmente.GESTION DE PROVEEDORESSupervisar, gestionar y controlar los proveedores de materiales y servicios solucionando y controlando las incidencias que pudieran suceder en orden a obtener la mejor calidad al menor coste y obtener un servicio de calidad.Coordinación de las actividades de los SPA.Coordinación de actividades de prevención con subcontratistas.GESTION Y SEGUIMIENTO DE PRL Y MAControlar y hacer seguimiento del plan de prevención de la compañía, la gestión de EPI´s y plan de emergencia.Gestión de residuos: generación, deposición, destrucción y documentación.Mantenimiento de los permisos y licencias administrativas.NUEVOS PROYECTOSColaborar en la redacción de requisitos de usuario, revisión de los equipos e instalaciones, ...SOPORTE A OTROS DEPARTAMENTOSRealizar el soporte técnico a cualquier departamento para la implantación de cualquier equipo, instalación o proceso que lo requiera.FORMACIÓN Grado en Ingeniería, ciencias ambientales, de la salud…Técnico superior de prevención de riesgos laboralesInglés nivel Medio (B2)OfimáticaMedioambiente, gestión de residuos, control ambientalEXPERIENCIA﻿Más de 2 años de experiencia en puestos similares se valorará conocimiento del sector farmacéutico o afines","Alcalá de Henares, Comunidad de Madrid, España",Pharmaloop (a Salvat company),Algo de responsabilidad,Jornada completa,Industria farmacéutica,"Otro,Ingeniería,Gestión de proyectos",2021-05-18 12:53:40,2021-05-18 13:00:00
linkedin,https://es.linkedin.com/jobs/view/cient%C3%ADfico-de-datos-junior-at-in2-ingenieria-de-la-informacion-2548559125,Científico de datos Junior ,"¿Qué buscamos?Te buscamos a ti, si eres un/a Consultor/a BI Junior con una experiencia valorable alrededor de 1 año y con conocimientos sólidos en BI/Científicos de datos para trabajar para una importante empresa IT con ubicación en Palma de Mallorca, sector turismo y tour-operador.¿Encaja con tu trayectoria y expectativas profesionales? ¡Estamos deseando conocerte!Trabajamos con las mejores empresas de nuestro sector.﻿Como Consultor/a BI Junior tus funciones y responsabilidades van a ser:Dar soporte en el desarrollo y consultoría Business Intelligence en tecnologías manejando múltiples herramientas de BI en proyectos punteros y en el área de Tecnologías avanzadas.Horario:– Jornada completa 40 horas– Posibilidades de Teletrabajo",España,IN2 INGENIERIA DE LA INFORMACION,Algo de responsabilidad,Jornada completa,Servicios y tecnologías de la información ,Tecnología de la información,2021-05-18 12:52:49,2021-05-18 13:00:00
linkedin,https://es.linkedin.com/jobs/view/data-strategy-manager-at-novartis-espa%C3%B1a-2555028209,Data Strategy Manager,"Job DescriptionThe Data Strategy Manager is responsible for driving the overall Data Strategy and lead the Data Strategy and Business Intelligence teams in order to leverage BiC, data driven, decision making at franchise level.Responsible for acting as the leader of all the Data Related teams (Data Strategy, Business Intelligence, CRM and others) with the objective to build a powerful data framework to support BiC decision Making and execution at brand level.Data framework integrates traditional pharma data sources but also new data including the one generated with the use of new digital channels, social media and others to support the evolution towards a customer centric business model. In that sense the inclusion of Data Science, II &ML capabilities is a key success factor for this role.Having a deep understanding of key business dynamics and customers as well as has full visibility over BF strategies, IT & data infrastructure in order to translate data into actionable insights.The Data Strategy Manager will strongly interact with multiple stakeholders; internally (Head of Customer Engagement, business Franchises, market access, medical, digital, legal, compliance, procurement & finance) and externally (customers, vendors, etc).Your responsibilities:Your responsibilities include, but are not limited to: Demonstrates strong intellectual curiosity with an interdisciplinary approach. Performs effective leadership and management of the Data Strategy and Business Intelligence Team according to Company needs Have effective leadership, management, coaching and counselling of all the data related teams (Data Strategy, Business Intelligence, CRM and others) and be responsible for establishing predictive and prescriptive analytics capabilities to support informed business decision making. Leverage all internal & external data sources as well as understanding of the local market and franchise strategies to maximize external performance, by identifying trends, opportunities and strategies. Ensures consistent internal data gathering, warehouse and use, across business franchises and functions. In addition to building a “customer in” mindset by consistently gather, storage and leverage customer data to feed business decision making. Perform causality and/or correlation analysis between activity and business KPIs in order to inform and drive business model transformation. Collaborates with Customer Engagement team in order to deliver to BFs BiC data driven decision making support. Identify the technology and infrastructure requirements to ensure optimal use of data, working in straight collaboration with the Head of Customer Engagement and with Digital Transformation Head . (Including hardware and software requirements and planning) Recognizes and exploits business opportunities to ensure more efficient and effective ways to use data science and explores ways of utilizing new data science tools and techniques to tackle business and organizational challengesMinimum RequirementsWhat you’ll bring to the role: 5+ of building and managing complex data frameworks to inform business decision making. Including 3+ years in leadership/management positions. Strong analysis, stakeholders management, communication, strategic and lateral thinking skills Experience in marketing & sales within pharmaceutical industry, is a plus (no mandatory) Result focus with high integrity and Project management experience Capacity to work under pressure Excellent execution skills and strong negotiation skills University degree in applied Maths, Statistics, bioscience, medicine, business, and/or economics, MBA preferred English fluency is required and Spanish fluency is a plusWhy consider Novartis?799 million. That’s how many lives our products touched in 2019. And while we’re proud of that fact, in this world of digital and technological transformation, we must also ask ourselves this: how can we continue to improve and extend even more people’s lives?We believe the answers are found when curious, courageous and collaborative people like you are brought together in an inspiring environment. Where you’re given opportunities to explore the power of digital and data. Where you’re empowered to risk failure by taking smart risks, and where you’re surrounded by people who share your determination to tackle the world’s toughest medical challenges.Imagine what you could do at Novartis!Commitment to Diversity & Inclusion:Novartis embraces diversity, equal opportunity and inclusion. We are committed to building diverse teams, representative of the patients and communities we serve, and we strive to create an inclusive workplace that cultivates bold innovation through collaboration, and empowers our people to unleash their full potential.Novartis are an equal opportunities employer and welcome applications from all suitably qualified personsJoin our Novartis Network: If this role is not suitable to your experience or career goals but you wish to stay connected to learn more about Novartis and our career opportunities, join the Novartis Network here: https://talentnetwork.novartis.com/network= NovartisDivisionPHARMABusiness UnitREGION EUROPE PHARMACountrySpainWork LocationBarcelonaCompany/Legal EntityNovartis Farmacéutica, S.A.Functional AreaCommercial & General ManagementJob TypeFull TimeEmployment TypeRegularShift WorkNo","Barcelona, Cataluña, España",Novartis España,Intermedio,Jornada completa,Industria farmacéutica,"Negocios,Gestión,Estrategia/planificación",2021-05-18 12:50:55,2021-05-18 13:00:00
linkedin,https://es.linkedin.com/jobs/view/t%C3%A9cnico-comercial-at-fresmak-soluciones-de-amarre-2547882477,Técnico comercial,"Fresmak busca incorporar en su equipo de I+D+i, una persona  con actitud innovadora e iniciativa con conocimientos de ingeniería mecánica y experiencia en fabricación por mecanizado para desarrollar la parte técnico-comercial de un proyecto innovador y disruptivo. Familiarizada con proyectos de I+D+i, su tarea tendrá como base buscar, filtrar, contactar y visitar clientes potenciales claves interesados en testar y confirmar la validez del producto en desarrollo.","Zarauz, País Vasco / Euskadi, España",FRESMAK | Soluciones de Amarre,,Jornada completa,,,2021-05-18 12:50:23,2021-05-18 13:00:00
linkedin,https://es.linkedin.com/jobs/view/secretario-jur%C3%ADdico-at-confidencial-2548555685,Secretario jurídico,"Despacho ubicado en Madrid busca para su departamento mercantil, una secretaria/recepcionista. Entre las funciones a realizar está la atención telefónica y reuniones, apoyo a los abogados, control y gestión de la documentación de cada expediente, ayuda en la preparación de cartas/propuesta y control de gestiones a realizar.Se solicita alto nivel de inglés y conocimientos avanzados de ofimática (paquete office 365). Se valorará experiencia en despacho o asesoría jurídica y manejo de plataformas de gestión documental.Es imprescindible que sea una persona organizada, proactiva y rigurosa en la realización del trabajo. Se exige buena presencia.Jornada completa de 11:00h a 20:00 (con una hora de descanso a mediodía).Incorporación inmediata","Madrid, Comunidad de Madrid, España",Confidencial,,Jornada completa,,,2021-05-18 12:49:31,2021-05-18 13:00:00
linkedin,https://es.linkedin.com/jobs/view/contable-multicliente-ingles-alto-real-estate-inmobiliario-at-intertrust-group-2548558302,Contable Multicliente ingles alto (Real Estate/Inmobiliario),"Buscamos un Junior Contable con Inglés alto para trabajar en una de las líneas de negocio de nuestra empresa en la que los clientes son mayoritariamente Fondos, Inmobiliario/Real EstateFunciones:Contabilidades, reporting, preparación y emisión de facturas de diversas sociedadesConciliaciones bancarias, preparación y presentación de las liquidaciones de impuestos y del SII, preparación y revisión de cuentas anuales.2 años de experiencia en puesto similar y en empresa multicliente preferiblementeSe requiere nivel Alto de inglés",Madrid y alrededores,Intertrust Group,Algo de responsabilidad,Jornada completa,Servicios financieros,Contabilidad/Auditorías,2021-05-18 12:48:40,2021-05-18 13:00:00
