"website","url","title","description","location","company","experience","worktype","industry","function","publish_date","insert_date"
linkedin,https://es.linkedin.com/jobs/view/principal-software-engineer-openshift-networking-remote-at-red-hat-2541784249,Principal Software Engineer - OpenShift Networking - Remote,"Job SummaryThe Red Hat Engineering team is looking for a Principal Software Engineer to join our global Red Hat OpenShift Networking team in Spain. In this role, you will work as part of a global software development team to design, architect, and implement future networking solutions for Red Hat OpenShift. Your main responsibilities will be related to Red Hat OpenShift and networking solutions, you will work as part of a distributed team on your own and in close collaboration across Red Hat's platform engineering teams.Primary Job ResponsibilitiesDesign, develop, and implement networking solutions for Red Hat's next-generation platforms, including Kubernetes and Red Hat OpenShiftBecome responsible for our product quality, participate in peer code reviews, continuous integration and delivery, and respond to security threats Participate in, lead, and create upstream networking project communities, including contributing new development work and existing features and fixes for projects like Kubernetes and Open Virtual Networking (OVN)Use your deep networking expertise to help customers solve complex business problems with creative solutionsRequired SkillsSignificant development experience with Kubernetes and container networking technologiesKnowledge of network switching and routing protocolsExperience with network functions virtualization (NFV) and software-defined networking (SDN)Experienced Go developer or solid background in any other language and willingness to learn GoMotivated with a proactive attitude, willingness to tackle new problems, and an ability to develop new architectures and identify good onesAbility to work well as part of a team in a highly collaborative, distributed, environment with a diverse teamUnderstanding of how open source and free software communities workGood English language skillsThe Following Are Considered a PlusExperience with Red Hat OpenShiftExperience with Linux networking technologiesExperience with development for public cloud services, including Amazon Web Services (AWS), Google Compute Engine (GCE), or Microsoft AzureAbility to present to customers and stakeholdersPrevious contributions to open source projects or being an open source maintainerAbout Red HatRed Hat is the world’s leading provider of enterprise open source software solutions, using a community-powered approach to deliver reliable and high-performing Linux, hybrid cloud, container, and Kubernetes technologies. Red Hat helps customers integrate new and existing IT applications, develop cloud-native applications, standardize on our industry-leading operating system, and automate, secure, and manage complex environments. Award-winning support, training, and consulting services make Red Hat a trusted adviser to the Fortune 500. As a strategic partner to cloud providers, system integrators, application vendors, customers, and open source communities, Red Hat can help organizations prepare for the digital future.Red Hat is proud to be an equal opportunity workplace and an affirmative action employer. We review applications for employment without regard to their race, color, religion, sex, sexual orientation, gender identity, national origin, ancestry, citizenship, age, veteran status, genetic information, physical or mental disability, medical condition, marital status, or any other basis prohibited by law.Red Hat does not seek or accept unsolicited resumes or CVs from recruitment agencies. We are not responsible for, and will not pay, any fees, commissions, or any other payment related to unsolicited resumes or CVs except as required in a written contract between Red Hat and the recruitment agency or party requesting payment of a fee.","Barcelona, Cataluña, España",Red Hat,No corresponde,Jornada completa,"Software,Servicios y tecnologías de la información ","Ingeniería,Tecnología de la información",2021-05-18 16:43:14,2021-05-18 17:00:00
linkedin,https://es.linkedin.com/jobs/view/administrativo-contable-at-universal-music-publishing-group-2541778857,Administrativo Contable,"Buscamos un Administrativo Contable para el Departamento Financiero de Universal Music Publishing, cuyas principales funciones serían:Gestión de cierres contables en SAP: Contabilidad de asientos, facturación a clientes y proveedores, cobros, pagos, impuestos y cierre mensual. Cuadres bancarios Sistema de información de resultados al grupo ( HFM) y herramienta de planificación contable (BPC).Seguimiento de las Sarbanes Oxley.","Madrid, Comunidad de Madrid, España",Universal Music Publishing Group,,Jornada completa,,,2021-05-18 16:42:24,2021-05-18 17:00:00
linkedin,https://es.linkedin.com/jobs/view/education-content-specialist-videoask-at-typeform-2549119795,Education Content Specialist (VideoAsk),"About Typeform / VideoAskOne sunny Barcelona morning, two designers sat down to build a beautiful lead gen form for a bathroom company’s showroom. They ended up reimagining the data collection experience, and realized it was one idea they wouldn’t be flushing down the toilet. Today, Typeform is a team of over 300 people from more than 35 countries, with offices in Barcelona, Spain and San Francisco, US.We’re building a world where brands, businesses, and their communities can have more personal relationships with the people who matter most. To do this, we give people the tools they need to have conversational experiences at scale—because meaningful relationships start with conversations.VideoAsk is our latest product, a video-driven UX that makes asynchronous interactions with any audience easy and engaging. We are scaling fast and we need people like you to help us run it as a small startup inside Typeform. Interested to be part of the future of online interaction? Keep reading then.About the TeamYou will be part of the Education team. We're a small team creating and managing VideoAsk's customer-facing help and documentation materials. We write tutorials, inspirational guides and videos to help and engage our user base. We're part of the Customer Success department, helping us to stay as close to our users as possible, and work closely with our Product and Marketing teams to make sure we're up to date and on-brand.About the RoleAs part of the VideoAsk Customer Success team, the Learning and Development Content Specialist is responsible for creating great content about VideoAsk that supports and inspires our users. You will keep our Help Center and blog up to date by documenting product features and integrations, and showcasing innovative product use cases with clear, friendly and fun articles and videos. Besides, you'll bridge the gap between our customer support, marketing, COM and sales teams and the product. What you’ll do:Become an expert in VideoAsk features, integrations and use casesWrite clear and concise Help Center articles to guide users through product features and integrations that are easy to follow no matter their skill levelCreate engaging articles to capture customer stories, use cases and creative end to end workflows to inspire our users to do more with VideoAskRecord high quality, easy to follow video tutorials and templatesTrack and prioritize Help Center needs for a rapidly evolving product with the rest of the VideoAsk Education teamMeasure and show the success of your work using dataTrack and interpret customer feedback from Customer Support to address user pain points in our documentation and inspiration contentWork cross-functionally with other teams such as Sales, Customer Outcomes and Partnerships, with VideoAsk education content or demonstrationsAbout You﻿Here's what we're after:2+ years of experience in a Customer training or education roleProven expertise building up from scratch educational content for a technical SaaS platform or fast-growing tech companyPrior experience working on Help Center articles and product for users with a different technical skillsetComfortable creating documentation about new product features or improvements that can people resolve problemsAbility to quickly understand technically complex information and translate into terms that are easy to understandNative or close to English language skills, fun and inviting writing style (but still horrified by grammatical errors and typos)Adaptive and creative thinking to take advantage of the evolving opportunities of a growing teamComfortable working autonomously and own projects in a fully remote work environmentTechnical understanding of cloud-based services, networking, and internet conceptsEnjoy recording yourself and being on camera (we love it!)Manage multiple projects and keep things on track in a fast-moving work environmentDown to earth, friendly, and humble with your colleaguesEye for detail and visually orientedIt'd be amazing if you also have:Video tutorial recording experienceMarketing copywriting experienceBasic HTML/CSS knowledgeExperience working for a SaaS productPrevious customer support experienceInterested? Hit Apply now and show us what you’ve got.*Today, more than 2.5M people from all over the world use Typeform. We celebrate the diversity of our customer base, and we want our employees to reflect those differences. At Typeform, we’re committed to equal employment opportunity regardless of race, colour, ancestry, religion, sex, national origin, sexual orientation, age, citizenship, marital status, disability, gender, gender identity or expression, or veteran status. We strive to be a more equal opportunity workplace.","Barcelona, Cataluña, España",Typeform,Intermedio,Jornada completa,"Software,Servicios y tecnologías de la información ","Atención al cliente,Educación",2021-05-18 16:42:33,2021-05-18 17:00:00
linkedin,https://es.linkedin.com/jobs/view/empleado-de-back-office-at-eaf-consilio-2555255724,Empleado de Back Office,"Responsable de la recopilación de información financiera de clientes privados depositadas en diferentes instituciones. Consolidación e integración de las posicionesSeguimiento de las recomendaciones formuladas, de su correcta tramitación y recopilación de la documentación correspondiente así como de su conciliación",Madrid y alrededores,EAF Consilio,,Jornada completa,,,2021-05-18 16:42:43,2021-05-18 17:00:00
linkedin,https://es.linkedin.com/jobs/view/psic%C3%B3logo-educacional-at-valora-recursos-humanos-2549123032,Psicólogo educacional,"Psicólogo Infanto-Juvenil Senior Cognitivo ConductualCentro Psicológico de Barcelona integrado por un equipo de más de 50 profesionales del ámbito de la infancia, juvenil y adultos, precisa contratar a dos Psicólogos sénior en el ámbito Infanto- Juvenil especializados en Terapia Cognitivo Conductual.Se responsabilizarán de la evaluación psicológica, el diagnóstico, el tratamiento psicológico.Jornada laboral que puede oscilar entre 30- 40 horas a combinar de lunes a viernes, aunque pueden considerarse candidaturas que solo tengan una dedicación menor, siempre que haya un mínimo de 3 o 4 tardes a la semana.Se ofrece contrato laboral indefinido, alta en seguridad social. Incorporación en junio. Según disponibilidad.Requisitos Imprescindibles: 1. Acreditación de Psicólogo generalista sanitario, valorándose especialmente la acreditación Psicólogo especialista en clínica (PIR)2. Formación complementaria Cognitivo Conductual, valorando especialmente las personas que tengan acreditación en este tipo de terapia (por ejemplo obtenida en SCRITC Societat Catalana de Recerca i Terapia de Conducta).3. Conocimientos de TDAH, trastornos del aprendizaje, trastornos emocionales y de conducta. 4. Profesional con experiencia de al menos 8 años trabajando dentro del ámbito de la psicología clínica infanto juvenil.5. Orientación y línea de trabajo cognitivo conductual6.Catalán hablado con fluidezRequisitos muy valorables1. La experiencia en entorno hospitalario es un plus.2. Acreditaciones: ADOS + ADI-R3. Conocimientos de TEA.4. Inglés ","Barcelona, Cataluña, España",Valora Recursos Humanos,Intermedio,Jornada completa,"Recursos humanos,Atención a la salud mental,Atención sanitaria y hospitalaria","Atención médica,Educación,Otro",2021-05-18 16:41:50,2021-05-18 17:00:00
linkedin,https://es.linkedin.com/jobs/view/ch%C3%B3fer-de-cami%C3%B3n-y-tr%C3%A1iler-at-mercavia-retamar-s-l-2549120092,Chófer de camión y tráiler,"El perfil de conductores que incorporaremos a nuestra plantilla profesional de Barcelona deben ser personas estables y proactivas, con capacidad de adaptabilidad y conducción en equipo, comprometidas, responsables, respetuosas y con actitud positiva.Ofrecemos estabilidad laboral con un buen y respetuoso ambiente de trabajo, plan de incentivos por buen desempeño.Nuestra flota continuamente renovada la mantenemos al día en revisiones y mantenimientos para ofrecer las mejores garantías de seguridad a nuestros conductores y el mejor servicio a nuestros clientes.Participa en el proceso de selección para:A. Conductores para rutas nacionales o internacionales para conducir con tráiler o tren de carretera. Las rutas son fijas y a doble conductor con 2 días de descanso a la semana en casa.B. Conductores para plaza por Barcelona para conducir tráiler o tren de carretera.Requisitos técnicos:Carnet C+E (Preferiblemente ADR)Tarjeta de tacógrafoCAPTodo vigenteTipo de puesto: Jornada completa, IndefinidoSalario: 20.000,00€-30.000,00€ al añoHorario:De lunes a viernes o de martes a sábado.Retribución complementaria:Bonus por objetivosPlan de comisionesIdioma:Español (Obligatorio)Disponibilidad para viajar:","Barcelona, Cataluña, España",Mercavia Retamar S.L,,Jornada completa,,,2021-05-18 16:41:58,2021-05-18 17:00:00
linkedin,https://es.linkedin.com/jobs/view/expert%40-en-diversidad-e-inclusi%C3%B3n-empresa-ibex-35-servicios-corporativos-at-people-first-consulting-2555256979,Expert@ en Diversidad e Inclusión- Empresa IBEX 35- Servicios Corporativos,"En People First Executive Search ( www.peoplefirstconsulting.es) estamos buscando para nuestro cliente, compañía multinacional,  perteneciente al IBEX 35, comprometida con la innovación, el talento y la sostenibilidad,  la posición de:EXPERT@ EN  DIVERSIDAD E INCLUSIÓNMisiónFormarás parte del equipo de Dirección Corporativa de Relaciones Laborales y DIVERSIDAD con capacidad para las siguientes Funciones y Responsabilidades: - Apoyo a la gestión de la diversidad en sus diferentes ámbitos- Estudios de mercado, propuesta y diseño de iniciativas para la consecución de los objetivos de la compañía- Participación en el desarrollo de la política corporativa de diversidad e inclusión, planes de igualdad y auditorías retributivas- Elaboración de informes, presentaciones y seguimiento del mapa de diversidad- Preparación de jornadas de formación, campañas de sensibilización- Preparación de noticias, comunicados en canales internos y redes sociales. - Colaboración en auditorías, certificaciones, ratings e informes ESG Requisitos del puestoLicenciatura o Grado SuperiorFormación específica en DIVERSIDADManejo avanzado de herramientas ofimáticas y herramientas de diseño y plantillas prediseñadas para infografías y videosExcelente nivel de inglés (C1 o superior)Persona creativa, innovadora y proactiva que le apasione trabajar en la gestión de personas y habilidades de comunicación.Capacidad de trabajo en equipo, carácter conciliador y diplomático.. Ubicación de la Posición: MadridNuestro cliente cuenta con un magnífico ambiente de trabajo, con un espíritu de mejora continua,  en un entorno de apoyo, colaboración y desarrollo entre colegas y managers que te ayudarán a conseguir tus objetivos personales y profesionales, mientras desarrollas tu carrera profesional. Si compartes esta visión, eres un apasionado de que “las cosas sucedan” y estás interesado/a puedes hacernos llegar tu CV a executivesearch@peoplefirstconsulting.es con la referencia : DIVERSIDAD E INCLUSIONNuestra Compañía agradece de antemano su interés a todos los candidatos e informa que solo se pondrá en contacto con las personas seleccionadas para realizar una entrevista.","Madrid, Comunidad de Madrid, España",People First Consulting,,Jornada completa,,,2021-05-18 16:41:07,2021-05-18 17:00:00
linkedin,https://es.linkedin.com/jobs/view/it-recruiter-at-hays-2549120437,IT Recruiter,"Desde Hays, la empresa líder en consultoría de selección a nivel mundial y con un equipo de 300 personas, ayudamos a las empresas a encontrar los mejores perfiles de su mercado y tenemos proyectos muy potentes para ofrecer a nuestros candidatos.¿Qué buscamos?Que sientas pasión por las personas y tengas buenas habilidades comunicativas.Que sientas ambición por superar tus propios resultados, que te motive aprender, y que tengas habilidad para adaptarte más rápido que el resto.Que no pongas límite a tu carrera, que siempre des tu 100% y que tengas una actitud ganadora.Profesionales que quieran continuar su carrera profesional reclutando y seleccionando perfiles IT. Estamos liderando proyectos para importantes clientes donde podremos contribuir significativamente con su negocio incorporando talento en áreas técnicas.Te encargarás de gestionar procesos de selección en el sector de IT a nivel nacional así como también de gestionar clientes y ser líder del proceso de principio a fin, aportando nuevas estrategias para la consecución de objetivos y trabajando de forma cercana con consultores de IT de todas nuestras líneas de negocio.Serás el/la candidato/a que buscamos si tienes experiencia en selección de perfiles IT, orientación a las personas y objetivos. Será altamente valorable el dominio de Inglés.¿Qué ofrecemos?Sabemos que todo esfuerzo tiene su recompensa y desde Hays, ofrecemos un paquete retributivo atractivo y sin límite. Si cumples y superas tus objetivos, ganarás mucho dinero!Formarás parte de un equipo de trabajo dinámico y divertido porque para nosotros el ambiente es parte de lo que somos.Disfrutarás de un plan de carrera individual y un plan de retribución flexible por el que podrás disponer desde tickets restaurant, seguro médico y hasta descuentos para el gimnasio, porque queremos que estés y te sientas bien.¡Si te sientes identificado/a y estás buscando un proyecto como el nuestro, no dudes en aplicar y te contaremos más sobre ésta oportunidad; así como también podremos orientarte sobre el mercado laboral!","Barcelona, Cataluña, España",Hays,Sin experiencia,Jornada completa,Dotación y selección de personal,"Recursos humanos,Tecnología de la información",2021-05-18 16:40:19,2021-05-18 17:00:00
linkedin,https://es.linkedin.com/jobs/view/finance-business-controller-at-statkraft-2555256878,Finance Business Controller,"Finance Business Controller Valencia or MadridSalary: Competitive + Bonus and BenefitsStatkraft is a leading company in hydropower internationally and Europe’s largest generator of renewable energy. The Group produces hydropower, wind power, solar power, gas-fired power, and supplies district heating. Statkraft is a global company in energy market operations and has 4500 employees in 17 countries.We are expanding rapidly and now have an exciting opening for an experienced Business Controller to join our European Wind and Solar (E) Finance team in Spain. The role can be based in either Madrid or Valencia.E Finance is responsible for financial reporting, performance management, business controlling and supporting projects in E. The Business Controller is part of the Business Partner and Controlling team in E Finance. Reporting to the Business Partner for the relevant area, the Business Controller has a supporting role to the line management and asset owners in wind and solar power. Key activities and responsibilities: Support the Asset Owners & Business Partner to drive business performance, create value in the business unit through useful analysis and adequate business controlling tools and processes.Take Project controller role for wind and solar development projects in Spain until ready-to-be build stage.Analyse and report financial figures in the geographical area to the management. Develop and follow up relevant KPIs, figures and reports for line and project managers. Performance management throughout the year including budgeting, forecasting and target setting.Benchmark and analyse of the relevant business in cooperation with asset owners.Support Due diligence processes in investments and divestments. What we are looking for:Minimum 5 years+ of relevant experience.Minimum University degree in accountancy, finance or similar with documented extensive experience in the field.Relevant business knowledge and understanding.Experience within a project-lead business in a multinational set-up is desirable.Analytical, process and result oriented.Independent self-starter, able to prioritize tasks and effectively working under pressure.Ability to cooperate and build relationships across the wider business.Fluency in Spanish and English.Strong knowledge desired on applications including ERP/BW systems, MS Excel, and other MS applications. What we offer:﻿Professional and personal development in an exciting European energy companyA positive working environment characterised by competence, responsibility and innovationA diverse workplace with regard to gender, age and cultural backgroundCompetitive terms of employment and excellent benefit schemes To apply please submit your CV in English along with your salary expectations and notice period.Statkraft is an equal opportunity employer. All qualified applicants will receive consideration for employment without regard to race, color, age, religion, sex, national origin or disability.","Madrid, Comunidad de Madrid, España",Statkraft,Intermedio,Jornada completa,Energía renovable y medio ambiente,"Contabilidad/Auditorías,Finanzas",2021-05-18 16:35:18,2021-05-18 17:00:00
